{
  "$schema": "state-schema-v5.json",
  "version": "5.0",
  "meta": {
    "title": "庶妹换我婚书那夜，太子先开了口",
    "genre": "宫斗宅斗",
    "platform": "番茄",
    "target_chapters": 12,
    "target_words": 48000,
    "created_at": "2026-03-21T06:21:19Z",
    "updated_at": "2026-03-21T07:11:33Z"
  },
  "progress": {
    "current_chapter": 1,
    "total_words": 3544,
    "last_write_chapter": 1,
    "last_write_time": "2026-03-21T07:11:33Z",
    "milestones": {
      "golden_three_completed": false,
      "first_arc_completed": false,
      "midpoint_reached": false
    }
  },
  "entities": {
    "characters": {
      "protagonist": {
        "name": "谢云昭",
        "aliases": [],
        "power": {
          "realm": "",
          "level": "",
          "layer": 0
        },
        "location": {
          "current": "安平伯府正厅",
          "origin": "安平伯府"
        },
        "inventory": [
          "旧婚书抄件",
          "母亲遗下的半枚玉扣"
        ],
        "abilities": [
          "识人观色",
          "记账与管事",
          "临场应对"
        ],
        "status": [
          "伯府庶女",
          "婚事被夺",
          "被继母压制"
        ],
        "current_goals": [
          "保住性命",
          "夺回婚书主动权",
          "查清生母旧死因"
        ],
        "known_secrets": [],
        "recent_events": [
          "在正堂以旧婚书抄件和亡母旧账线索逼停换婚书",
          "东宫内侍奉太子口信入府追问婚书归属"
        ]
      },
      "active": [],
      "archived": []
    },
    "items": {
      "tracked": [
        "旧婚书抄件",
        "半枚玉扣"
      ],
      "protagonist_inventory": [
        "旧婚书抄件",
        "母亲遗下的半枚玉扣"
      ]
    },
    "locations": {
      "current": "安平伯府",
      "visited": [],
      "important": [
        "安平伯府",
        "祠堂",
        "东宫"
      ]
    }
  },
  "plot_threads": {
    "foreshadowing": {
      "active": [
        "生母死因旧账",
        "婚书被换的幕后推手",
        "东宫为何介入"
      ],
      "pending": [],
      "warning": [],
      "overdue": [],
      "resolved": []
    },
    "suspense": {
      "active": [
        "柳氏与谢明珠为何急于在今夜换婚书",
        "太子为何会在婚书当夜点名安平伯府"
      ],
      "resolved": []
    },
    "main_quest": {
      "target": "从被压制的庶女位置翻身，进入更高权力层并查清旧案",
      "location": "安平伯府 / 东宫线",
      "secret": "继母与庶妹急着换婚书，不只是想夺婚事，还想掩盖上一代留下的账。",
      "progress": 10
    },
    "side_quests": []
  },
  "knowledge_base": {
    "reader_knows": [
      "柳氏与谢明珠在婚书上动了手脚",
      "谢云昭手里留有旧婚书抄件和亡母旧账线索",
      "东宫已经介入安平伯府的婚书风波"
    ],
    "protagonist_knows": [
      "婚书被换并非临时起意",
      "柳氏认得亡母旧账页",
      "今夜反击已经把婚书局推到府外"
    ],
    "protagonist_doesnt_know": [
      "太子为何会在今夜插手婚书局",
      "亡母旧死因背后的完整链条",
      "婚书被换背后是否还有更高层的授意"
    ],
    "key_revelations": [
      "换婚书不仅是夺婚事，也牵出旧年账目",
      "谢云昭第一次在正堂当众反咬并逼停压制"
    ]
  },
  "quality_metrics": {
    "recent_scores": [
      82
    ],
    "average_score": 82,
    "trend": "stable",
    "last_review_chapter": 1,
    "dimension_scores": {
      "爽点": 82,
      "一致性": 85,
      "节奏": 80,
      "OOC": 78,
      "连续性": 80,
      "追读力": 87
    }
  },
  "learned_patterns": {
    "writing_style_preferences": {
      "dialogue_style": "含锋带刺、话中有话",
      "description_density": "中等偏高",
      "pacing_preference": "压制-试探-反击-挂更大局"
    },
    "high_point_preferences": [],
    "avoid_patterns": [],
    "user_feedback": []
  },
  "auto_learn_config": {
    "enabled": true,
    "milestone_chapters": 10,
    "milestone_words": 50000,
    "quality_threshold": 70,
    "consecutive_low_quality_trigger": 3,
    "min_analysis_chapters": 5,
    "cooldown_hours": 24,
    "last_auto_learn": null,
    "last_auto_learn_chapter": 0
  },
  "platform_config": {
    "name": "番茄",
    "pacing": "强压制 + 快反击 + 章末挂更大局",
    "chapter_words": {
      "min": 2800,
      "max": 4200,
      "target": 3500
    },
    "golden_three": {
      "hook_timing": "第1章直接见压制关系",
      "cheat_timing": "不适用"
    },
    "suspense_timing": {
      "cheat_awakening": 0,
      "main_goal_reveal": 1,
      "core_twist": 3
    }
  },
  "genre_profile": {
    "loaded": "palace-intrigue/profile.yaml",
    "bucket": "宫斗宅斗",
    "节奏": {
      "type": "慢热铺垫型",
      "tension_ratio": "4:6",
      "typical_chapter_length": 4500
    },
    "爽点密度": 0.8,
    "strand权重": {
      "quest": 30,
      "fire": 45,
      "constellation": 25
    },
    "特殊约束": [
      {
        "id": "RULE-001",
        "description": "尊卑有序，下位者不能轻易冒犯上位者",
        "checkpoint": "行为与对话"
      },
      {
        "id": "RULE-003",
        "description": "对手要有智商，斗争手段要成立",
        "checkpoint": "对手塑造"
      }
    ]
  },
  "chapter_meta": {
    "1": {
      "title": "婚书被换那夜",
      "word_count": 3544,
      "summary": "柳氏与谢明珠在正堂逼谢云昭按下换婚书手印，谢云昭亮出旧婚书抄件与亡母旧账线索，当场逼停换婚书，章末东宫内侍奉太子口信入府追问婚书归属。",
      "status": "draft",
      "content_bucket": "宫斗宅斗",
      "updated_at": "2026-03-21T07:11:33Z",
      "review_score": 82,
      "review_grade": "B",
      "review_time": "2026-03-21T07:04:46Z",
      "dimension_scores": {
        "爽点": 82,
        "一致性": 85,
        "节奏": 80,
        "OOC": 78,
        "连续性": 80,
        "追读力": 87
      },
      "needs_fix": false,
      "recommended_next_action": "novel-review",
      "warnings": [],
      "suggested_fixes": [],
      "last_fix_time": "2026-03-21T07:11:33Z",
      "fix_count": 1,
      "fixed_issues": [
        "压缩前半段从偷听到翻旧账房的说明性段落，把翻盘注意力收回婚书局现场。",
        "在章末补强谢云昭对东宫介入后果的即时判断，让更大局承接更硬。"
      ]
    }
  },
  "chapter_snapshots": {
    "1": {
      "title": "婚书被换那夜",
      "word_count": 3415,
      "summary": "完成开局压制、当场反咬与东宫介入钩子。",
      "saved_at": "2026-03-21T06:55:24Z"
    }
  },
  "summaries_index": {
    "1": "柳氏与谢明珠在正堂逼谢云昭按下换婚书手印，谢云昭亮出旧婚书抄件与亡母旧账线索，当场逼停换婚书，章末东宫内侍奉太子口信入府追问婚书归属。"
  },
  "character_states": {},
  "setting_versions": {},
  "market_adjustments": {
    "last_applied": null,
    "source_scan": null,
    "adjustments": []
  },
  "dungeons": {
    "completed": [],
    "current": null
  },
  "teammates": {
    "active": [],
    "inactive": []
  },
  "constraints_loaded": {
    "core_constraints": "references/shared/core-constraints.md",
    "version": "5.6",
    "loaded_at": "2026-03-21T06:21:19Z",
    "includes": [
      "profiles/palace-intrigue/profile.yaml"
    ]
  }
}
