{
  "$schema": "state-schema-v5.json",
  "version": "5.0",
  "meta": {
    "title": "离婚后我不再忍了",
    "genre": "现实题材",
    "platform": "番茄",
    "target_chapters": 8,
    "target_words": 32000,
    "created_at": "2026-03-21T05:41:57Z",
    "updated_at": "2026-03-21T08:45:00Z"
  },
  "progress": {
    "current_chapter": 1,
    "total_words": 2922,
    "last_write_chapter": 1,
    "last_write_time": "2026-03-21T08:45:00Z",
    "milestones": {
      "golden_three_completed": false,
      "first_arc_completed": false,
      "midpoint_reached": false
    }
  },
  "entities": {
    "characters": {
      "protagonist": {
        "name": "沈知意",
        "aliases": [],
        "power": {
          "realm": "",
          "level": "",
          "layer": 0
        },
        "location": {
          "current": "海城餐厅门口",
          "origin": "海城"
        },
        "inventory": [
          "个人证件",
          "工作电脑",
          "离婚相关资料",
          "手机"
        ],
        "abilities": [
          "法律常识",
          "谈判能力",
          "新媒体运营"
        ],
        "status": [
          "公开提出离婚",
          "开始主动留证",
          "准备搬离婚房"
        ],
        "current_goals": [
          "把婚房、流水和共同支出证据先抓到手里",
          "联系律师并启动切割",
          "不再给周承礼一家留转圜空间"
        ],
        "known_secrets": [
          "周承礼最怕的不是离婚本身，而是她开始认真算账"
        ],
        "recent_events": [
          "沈知意在家庭聚餐上被当众羞辱",
          "沈知意打开录音并把证据线发给许雯",
          "沈知意第一次当众提出离婚"
        ]
      },
      "active": [],
      "archived": []
    },
    "items": {
      "tracked": [
        "离婚相关资料",
        "房贷流水"
      ],
      "protagonist_inventory": [
        "个人证件",
        "工作电脑",
        "离婚相关资料",
        "手机"
      ]
    },
    "locations": {
      "current": "海城餐厅门口",
      "visited": [
        "海城餐厅"
      ],
      "important": [
        "婚房",
        "海城餐厅"
      ]
    }
  },
  "plot_threads": {
    "foreshadowing": {
      "active": [
        {
          "id": "f1",
          "name": "利益切割异常",
          "description": "周承礼对离婚的慌乱远超正常反应，说明婚房、流水或其他共同财务里还藏着不能翻开的账。",
          "planted_chapter": 1,
          "expected_range": "2-6",
          "status": "planned",
          "related_entities": [
            "沈知意",
            "周承礼",
            "婚房"
          ],
          "importance": "high"
        }
      ],
      "pending": [],
      "warning": [],
      "overdue": [],
      "resolved": []
    },
    "suspense": {
      "active": [
        {
          "question": "周承礼到底在怕哪一笔账被翻出来？",
          "since_chapter": 1
        }
      ],
      "resolved": []
    },
    "main_quest": {
      "target": "摆脱失衡婚姻，重建自我与生活秩序",
      "location": "海城",
      "secret": "前夫与婆家的控制不只来自情感问题，还牵连现实利益切割。",
      "progress": 15
    },
    "side_quests": []
  },
  "knowledge_base": {
    "reader_knows": [
      "沈知意长期在婚姻里被情感贬低和家庭控制",
      "周承礼和婆家最看重的是房子、钱和体面",
      "沈知意已经开始主动留证并准备算账"
    ],
    "protagonist_knows": [
      {
        "info": "周承礼真正怕的是她开始认真把账摊开。",
        "since_chapter": 1
      }
    ],
    "protagonist_doesnt_know": [
      "周承礼究竟隐瞒了哪些财务问题",
      "这场离婚切割会先从哪一条利益链爆开"
    ],
    "key_revelations": [
      "沈知意第一次在公开场合明确提出离婚。",
      "她不再只是翻脸，而是同步开始留证与切割。"
    ]
  },
  "quality_metrics": {
    "recent_scores": [],
    "average_score": 0,
    "trend": "stable",
    "last_review_chapter": 0,
    "dimension_scores": {
      "爽点": 0,
      "一致性": 0,
      "节奏": 0,
      "OOC": 0,
      "连续性": 0,
      "追读力": 0
    }
  },
  "learned_patterns": {
    "writing_style_preferences": {
      "dialogue_style": "现实克制但句句顶住要害",
      "description_density": "中等",
      "pacing_preference": "痛点开局 -> 公开翻脸 -> 现实留证 -> 下一步切割"
    },
    "high_point_preferences": [],
    "avoid_patterns": [],
    "user_feedback": []
  },
  "auto_learn_config": {
    "enabled": true,
    "milestone_chapters": 10,
    "milestone_words": 50000,
    "quality_threshold": 70,
    "consecutive_low_quality_trigger": 3,
    "min_analysis_chapters": 5,
    "cooldown_hours": 24,
    "last_auto_learn": null,
    "last_auto_learn_chapter": 0
  },
  "platform_config": {
    "name": "番茄",
    "pacing": "黄金三章强钩子 + 现实切割线",
    "chapter_words": {
      "min": 2000,
      "max": 5000,
      "target": 4000
    },
    "golden_three": {
      "hook_timing": "第1章",
      "cheat_timing": "不适用"
    },
    "suspense_timing": {
      "cheat_awakening": 0,
      "main_goal_reveal": 1,
      "core_twist": 3
    }
  },
  "genre_profile": {
    "loaded": "realistic/profile.yaml",
    "bucket": "现实情感",
    "节奏": {
      "type": "现实奋斗型",
      "tension_ratio": "5:5",
      "typical_chapter_length": 4500
    },
    "爽点密度": 0.7,
    "strand权重": {
      "quest": 40,
      "fire": 25,
      "constellation": 35
    },
    "特殊约束": [
      {
        "id": "REAL-001",
        "description": "现实感要强",
        "checkpoint": "整体氛围"
      },
      {
        "id": "REAL-002",
        "description": "不能太悬浮",
        "checkpoint": "情节设计"
      }
    ]
  },
  "chapter_meta": {
    "1": {
      "chapter": 1,
      "title": "你们敢当众踩我，我就敢把账摊开",
      "path": "chapters/第001章.md",
      "word_count": 2922,
      "status": "draft",
      "created_at": "2026-03-21T08:45:00Z",
      "updated_at": "2026-03-21T08:45:00Z",
      "summary": "家庭聚餐上，周承礼和婆家当众羞辱沈知意，逼她继续忍让。沈知意没有再替任何人圆场，而是边当众提出离婚，边暗中开启录音、联系律师，把这段婚姻最怕被翻开的那本账提前握进自己手里。"
    }
  },
  "chapter_snapshots": {
    "1": {
      "chapter": 1,
      "created_at": "2026-03-21T08:45:00Z",
      "word_count": 2922,
      "protagonist_state": {
        "name": "沈知意",
        "power": {
          "realm": "",
          "level": "",
          "layer": 0
        },
        "location": {
          "current": "海城餐厅门口",
          "previous": "海城餐厅包间"
        },
        "inventory": [
          "个人证件",
          "工作电脑",
          "离婚相关资料",
          "手机"
        ],
        "abilities": [
          "法律常识",
          "谈判能力",
          "新媒体运营"
        ],
        "status": [
          "公开提出离婚",
          "开始主动留证",
          "准备搬离婚房"
        ],
        "current_goals": [
          "把婚房、流水和共同支出证据先抓到手里",
          "联系律师并启动切割",
          "不再给周承礼一家留转圜空间"
        ]
      },
      "active_characters": [
        {
          "name": "周承礼",
          "role": "前夫",
          "relation": "对立",
          "last_interaction": 1
        },
        {
          "name": "周母",
          "role": "前婆婆",
          "relation": "对立",
          "last_interaction": 1
        }
      ],
      "active_foreshadowing": [
        {
          "id": "f1",
          "name": "利益切割异常",
          "status": "planted",
          "planted_chapter": 1
        }
      ],
      "knowledge_state": {
        "reader_knows": [
          "沈知意没有再忍，而是开始同步留证和算账",
          "周承礼和婆家最怕她碰的是具体利益切割"
        ],
        "protagonist_knows": [
          "只靠翻脸不够，必须马上把证据抓到手里"
        ],
        "protagonist_doesnt_know": [
          "周承礼究竟藏了哪一笔账",
          "下一步先炸开的会是哪条利益线"
        ]
      },
      "new_entities": [
        {
          "type": "character",
          "name": "周承礼",
          "role": "spouse-antagonist"
        },
        {
          "type": "character",
          "name": "周母",
          "role": "family-antagonist"
        },
        {
          "type": "location",
          "name": "海城餐厅"
        }
      ],
      "key_events": [
        "沈知意在家庭聚餐上被当众羞辱",
        "沈知意开启录音并同步联系律师",
        "沈知意第一次公开提出离婚",
        "周承礼威胁她什么都别想拿走"
      ],
      "summary": "沈知意没有再做那个替所有人圆场的人。她在当众提出离婚的同时，已经把录音和证据线同步握到手里，准备把这段婚姻里最见不得光的账一笔笔算回来。"
    }
  },
  "summaries_index": {
    "1": "家庭聚餐上，周承礼和婆家当众羞辱沈知意，逼她继续忍让。沈知意当众提出离婚，同时开启录音、联系律师，把这场婚姻里最怕被翻开的账先抓进自己手里。"
  },
  "character_states": {},
  "setting_versions": {},
  "market_adjustments": {
    "last_applied": null,
    "source_scan": null,
    "adjustments": []
  },
  "dungeons": {
    "completed": [],
    "current": null
  },
  "teammates": {
    "active": [],
    "inactive": []
  },
  "constraints_loaded": {
    "core_constraints": "references/shared/core-constraints.md",
    "version": "5.6",
    "loaded_at": "2026-03-21T05:41:57Z",
    "includes": [
      "profiles/realistic/profile.yaml"
    ]
  }
}
